{
  "$schema": "http://json-schema.org/draft-07/schema#",
  "$id": "https://xlb.local/schemas/tke/evidence-bundle.schema.json",
  "title": "XLB release safety evidence bundle",
  "type": "object",
  "additionalProperties": false,
  "required": ["schemaVersion", "releaseId", "environment", "updatedAt", "backup", "jobsSingleActive"],
  "properties": {
    "schemaVersion": { "const": 1 },
    "releaseId": { "$ref": "#/definitions/releaseId" },
    "environment": { "enum": ["staging", "production"] },
    "updatedAt": { "$ref": "#/definitions/timestamp" },
    "backup": {
      "type": "object",
      "additionalProperties": false,
      "required": ["backupId", "createdAt", "verifiedAt", "restoreDrill"],
      "properties": {
        "backupId": { "type": "string", "minLength": 1, "maxLength": 253 },
        "createdAt": { "$ref": "#/definitions/timestamp" },
        "verifiedAt": { "$ref": "#/definitions/timestamp" },
        "restoreDrill": {
          "type": "object",
          "additionalProperties": false,
          "required": ["performedAt", "result", "evidenceRef"],
          "properties": {
            "performedAt": { "$ref": "#/definitions/timestamp" },
            "result": { "const": "PASS" },
            "evidenceRef": { "$ref": "#/definitions/artifactPath" }
          }
        }
      }
    },
    "jobsSingleActive": {
      "type": "object",
      "additionalProperties": false,
      "required": [
        "lighthouseState",
        "tkeState",
        "leaseOwner",
        "fencingToken",
        "observedAt",
        "evidenceRef"
      ],
      "properties": {
        "lighthouseState": { "enum": ["ACTIVE", "STOPPED"] },
        "tkeState": { "enum": ["ACTIVE", "STOPPED"] },
        "leaseOwner": { "type": "string", "minLength": 1, "maxLength": 253 },
        "fencingToken": { "type": "integer", "minimum": 1 },
        "observedAt": { "$ref": "#/definitions/timestamp" },
        "evidenceRef": { "$ref": "#/definitions/artifactPath" }
      }
    },
    "migration": { "$ref": "#/definitions/executionEvidence" },
    "smoke": { "$ref": "#/definitions/executionEvidence" },
    "trafficObservations": {
      "type": "array",
      "maxItems": 4,
      "items": {
        "type": "object",
        "additionalProperties": false,
        "required": ["weight", "observedAt", "result", "evidenceRef"],
        "properties": {
          "weight": { "enum": [5, 25, 50, 100] },
          "observedAt": { "$ref": "#/definitions/timestamp" },
          "result": { "enum": ["PASS", "FAIL"] },
          "evidenceRef": { "$ref": "#/definitions/artifactPath" }
        }
      }
    },
    "rollback": { "$ref": "#/definitions/executionEvidence" }
  },
  "definitions": {
    "releaseId": {
      "type": "string",
      "minLength": 6,
      "maxLength": 63,
      "pattern": "^[a-z0-9](?:[a-z0-9.-]*[a-z0-9])$"
    },
    "timestamp": {
      "type": "string",
      "pattern": "^\\d{4}-\\d{2}-\\d{2}T\\d{2}:\\d{2}:\\d{2}(?:\\.\\d{3})?Z$"
    },
    "artifactPath": {
      "type": "string",
      "pattern": "^\\.artifacts/tke/[a-z0-9./-]+$"
    },
    "executionEvidence": {
      "type": "object",
      "additionalProperties": false,
      "required": ["runId", "completedAt", "result", "evidenceRef"],
      "properties": {
        "runId": { "type": "string", "minLength": 6, "maxLength": 63 },
        "completedAt": { "$ref": "#/definitions/timestamp" },
        "result": { "enum": ["PASS", "FAIL"] },
        "evidenceRef": { "$ref": "#/definitions/artifactPath" }
      }
    }
  }
}
