{
  "schemaVersion": 1,
  "releaseId": "release-20260716-001",
  "environment": "production",
  "updatedAt": "2026-07-16T08:25:00Z",
  "backup": {
    "backupId": "backup-contract-sample",
    "createdAt": "2026-07-16T06:00:00Z",
    "verifiedAt": "2026-07-16T07:00:00Z",
    "restoreDrill": {
      "performedAt": "2026-07-15T06:00:00Z",
      "result": "PASS",
      "evidenceRef": ".artifacts/tke/releases/release-20260716-001/evidence/restore-drill.json"
    }
  },
  "jobsSingleActive": {
    "lighthouseState": "ACTIVE",
    "tkeState": "STOPPED",
    "leaseOwner": "lighthouse-jobs",
    "fencingToken": 1,
    "observedAt": "2026-07-16T08:20:00Z",
    "evidenceRef": ".artifacts/tke/releases/release-20260716-001/evidence/jobs-lease.json"
  },
  "trafficObservations": []
}
